{
  "$schema": "https://json-schema.org/draft/2020-12/schema",
  "$id": "https://registry.astra.app/schema/plugin-v1.json",
  "title": "astra.registry.plugin/1",
  "description": "plugins/<id>/plugin.json — the version-independent half of a listing. Hand-written, hand-reviewed, one file per plugin. Everything that changes per release lives in versions/<semver>.json instead, so a new release is a new file and never a conflicting edit.",
  "type": "object",
  "additionalProperties": false,
  "required": ["schema", "id", "name", "summary", "license", "source", "added_at"],
  "properties": {
    "$comment": { "type": "string" },
    "schema": { "const": "astra.registry.plugin/1" },
    "id": {
      "type": "string",
      "pattern": "^[a-z0-9](?:[a-z0-9-]{0,62}[a-z0-9])$",
      "description": "Must equal the containing directory name. Becomes a path component on every user's disk — tools/lib/ids.mjs checks far more than this pattern."
    },
    "name": { "type": "string", "minLength": 1, "maxLength": 64 },
    "summary": { "type": "string", "minLength": 1, "maxLength": 200 },
    "description": { "type": "string", "maxLength": 4000 },
    "author": {
      "type": "object",
      "additionalProperties": false,
      "required": ["name"],
      "properties": {
        "$comment": { "type": "string" },
        "name": { "type": "string", "minLength": 1, "maxLength": 64 },
        "url": { "type": "string", "pattern": "^https://" }
      }
    },
    "license": { "type": "string", "minLength": 1, "maxLength": 64 },
    "source": { "$ref": "#/$defs/source" },
    "homepage": { "type": "string", "pattern": "^https://" },
    "icon_url": {
      "$comment": "REFUSED, and still described here on purpose (BOT-79). No listing carries this field and nothing may add one: tools/validate.mjs errors on its presence, tools/build-index.mjs refuses to render a listing that has it, and schema/index-v1.json's `icon_url` pattern admits only a data: URI or the empty string. The shape is kept so that a hand-written listing gets the validator's sentence — what to do instead, and why — rather than a bare `additional property is not allowed` from this file. Delete the shape and that message goes with it.",
      "type": "string",
      "pattern": "^https://"
    },
    "icon": {
      "$comment": "A FILENAME beside this document, not a URL. The bytes are committed to the registry so a reviewer sees the actual picture in the pull request diff instead of a base64 blob, and tools/build-index.mjs inlines them into the signed index as a data: URI. Extracted from the attested bundle by bot/ingest.mjs. It is the only way a listing gets a picture: `icon_url` above is refused (BOT-79).",
      "enum": ["icon.png", "icon.webp", "icon.svg", "icon.jpg", "icon.jpeg", "icon.ico"]
    },
    "readme": {
      "$comment": "Likewise a filename beside this document. Markdown, sanitised when it was derived: no raw HTML, and every image either pinned to the attested commit or dropped to its alt text. bot/lib/assets.mjs says what is removed and why.",
      "enum": ["README.md"]
    },
    "i18n": {
      "$comment": "Per-locale card text, read out of the attested bundle's locales/<code>.json under the reserved keys `listing.name` and `listing.description` by bot/lib/locales.mjs. Derived, never hand-written, and never carried forward from a previous release: a locale a release stopped shipping disappears from the card rather than outliving the file it came from.\n\n`en` is NOT a key here. The flat `name`/`summary`/`description` above ARE the English and are never removed — a document that can carry the untranslated form twice will eventually carry two different versions of it. The codes below are AstraPlugins/spec/locales.yaml minus `en`, in its order; coupling C15 compares this enum against bot/lib/locales.mjs and against schema/index-v1.json, because a bot that emits a locale this schema rejects red-lines the deploy candidate for every listing rather than for the plugin that shipped it.\n\nNo README and no long-form text. Nine locales of card text is single-digit percent of the index; nine locales of README is more than three times the whole document, on a file every install fetches whole every hour. policy/limits.json's `max_index_bytes_note` carries the measurement.",
      "type": "object",
      "propertyNames": {
        "enum": ["ru", "uk", "de", "fr", "es", "pt", "ja", "zh", "ko", "kk"]
      },
      "additionalProperties": {
        "$comment": "Both halves or neither. A locale whose name is legitimately identical to English — which is what a brand name is — must not produce a block with a summary and no name, so the derivation fills the missing half from English rather than emitting a fragment.",
        "type": "object",
        "additionalProperties": false,
        "required": ["name", "summary"],
        "properties": {
          "$comment": { "type": "string" },
          "name": { "type": "string", "minLength": 1, "maxLength": 64 },
          "summary": { "type": "string", "minLength": 1, "maxLength": 200 }
        }
      }
    },
    "categories": {
      "type": "array",
      "maxItems": 3,
      "uniqueItems": true,
      "items": {
        "enum": [
          "ai", "audio", "automation", "communication", "development",
          "entertainment", "productivity", "system", "utilities", "voice"
        ]
      }
    },
    "keywords": {
      "type": "array",
      "maxItems": 10,
      "uniqueItems": true,
      "items": { "type": "string", "pattern": "^[a-z0-9][a-z0-9 -]{0,31}$" }
    },
    "added_at": {
      "type": "string",
      "pattern": "^[0-9]{4}-[0-9]{2}-[0-9]{2}$",
      "description": "The day this plugin was first listed. A date, not a timestamp: it is provenance, not telemetry."
    },
    "unlisted": {
      "type": "boolean",
      "description": "true keeps the listing in git and out of the generated index. Used to retire a plugin without deleting its audit trail."
    }
  },
  "$defs": {
    "source": {
      "type": "object",
      "additionalProperties": false,
      "required": ["kind", "repo"],
      "description": "Where the bytes come from. The daemon re-derives the expected download URL from this and refuses an artifact URL that does not sit under it (PRODUCTION_PLAN §5.3 A.6), so this field is a security control, not a link.",
      "properties": {
        "$comment": { "type": "string" },
        "kind": { "const": "github" },
        "repo": { "type": "string", "pattern": "^[A-Za-z0-9._-]+/[A-Za-z0-9._-]+$" },
        "subdirectory": { "type": "string", "pattern": "^[A-Za-z0-9._/-]+$" }
      }
    }
  }
}
