{
  "$comment": "Derived from Voltur792/auto-assistant@v1.2.2 by bot/ingest.mjs. Every field below is read out of the attested bundle except source.repo, which is taken from the build certificate's .12 (BOT-21) and the ownership check proves the submitter controls.",
  "schema": "astra.registry.plugin/1",
  "id": "auto-assistant",
  "name": "Auto Assistant",
  "summary": "Reads mail over IMAP, finds actionable important messages with a local model, and creates tasks, reminders and calendar events in Astra's native widgets.",
  "license": "MIT",
  "source": {
    "kind": "github",
    "repo": "Voltur792/auto-assistant"
  },
  "added_at": "2026-10-25",
  "description": "Reads mail over IMAP, finds actionable important messages with a local model, and creates tasks, reminders and calendar events in Astra's native widgets.",
  "author": {
    "name": "Voltur"
  },
  "icon": "icon.png",
  "readme": "README.md",
  "i18n": {
    "ru": {
      "name": "Авто-Помощник",
      "summary": "Читает почту по IMAP, находит письма с важными действиями с помощью локальной модели и создаёт задачи, напоминания и записи в штатном календаре Astra."
    }
  }
}
