{
  "$comment": "Derived from Voltur792/VC-Discord@v1.4.5 by bot/ingest.mjs. Every field below is read out of the attested bundle except source.repo, which is taken from the build certificate's .12 (BOT-21) and the ownership check proves the submitter controls.",
  "schema": "astra.registry.plugin/1",
  "id": "vc-discord",
  "name": "Voice communication-Discord",
  "summary": "Voice conversations, music and participant moderation in Discord; PC commands from the accounts you allow.",
  "license": "MIT",
  "source": {
    "kind": "github",
    "repo": "Voltur792/VC-Discord"
  },
  "added_at": "2026-10-25",
  "description": "Voice conversations, music and participant moderation in Discord; PC commands from the accounts you allow.",
  "author": {
    "name": "Voltur"
  },
  "icon": "icon.svg",
  "readme": "README.md",
  "i18n": {
    "ru": {
      "name": "Voice communication-Discord",
      "summary": "Голосовой разговор, музыка и управление участниками в Discord; команды ПК только с разрешённых аккаунтов."
    }
  }
}
