{
  "$comment": "Derived from mihailinl/AstraPlugins@text-utils-v0.1.4 by bot/ingest.mjs. Every field below is read out of the attested bundle except source.repo, which is taken from the build certificate's .12 (BOT-21) and the ownership check proves the submitter controls.",
  "schema": "astra.registry.plugin/1",
  "id": "text-utils",
  "name": "Text Utils",
  "summary": "Word count, case conversion, regex matching — with actions and triggers",
  "license": "MIT",
  "source": {
    "kind": "github",
    "repo": "mihailinl/AstraPlugins"
  },
  "added_at": "2026-08-10",
  "description": "Word count, case conversion, regex matching — with actions and triggers",
  "author": {
    "name": "Mihailin"
  },
  "icon": "icon.svg",
  "readme": "README.md",
  "i18n": {
    "ru": {
      "name": "Текстовые утилиты",
      "summary": "Подсчёт слов, смена регистра, поиск по регулярным выражениям — с действиями и триггерами"
    },
    "uk": {
      "name": "Текстові утиліти",
      "summary": "Підрахунок слів, зміна регістру, пошук за регулярними виразами — з діями та тригерами"
    }
  },
  "categories": [
    "productivity",
    "utilities"
  ],
  "keywords": [
    "text",
    "regex",
    "base64",
    "scheduled",
    "python"
  ],
  "homepage": "https://github.com/mihailinl/AstraPlugins/tree/master/examples/text-utils"
}
