{
  "$comment": "Derived from FluffyTaill/astra-anim-studio@v1.1.2 by bot/ingest.mjs. Every field below is read out of the attested bundle except source.repo, which is taken from the build certificate's .12 (BOT-21) and the ownership check proves the submitter controls.",
  "schema": "astra.registry.plugin/1",
  "id": "anim-studio",
  "name": "Anim Studio",
  "summary": "Add your own avatar animations (VRMA, Mixamo FBX, GLB) and choose when she plays them: when bored, to music, by time of day, or on a trigger.",
  "license": "MIT",
  "source": {
    "kind": "github",
    "repo": "FluffyTaill/astra-anim-studio"
  },
  "added_at": "2026-10-25",
  "description": "Add your own avatar animations (VRMA, Mixamo FBX, GLB) and choose when she plays them: when bored, to music, by time of day, or on a trigger.",
  "author": {
    "name": "Taill"
  },
  "icon": "icon.svg",
  "readme": "README.md",
  "i18n": {
    "ru": {
      "name": "Anim Studio",
      "summary": "Добавляй аватару свои анимации (VRMA, FBX из Mixamo, GLB) и выбирай, когда она их играет: от скуки, под музыку, по времени суток или по триггеру."
    }
  }
}
