{
  "$comment": "Derived from Voltur792/detective-game@v0.4.2 by bot/ingest.mjs. Every field below is read out of the attested bundle except source.repo, which is taken from the build certificate's .12 (BOT-21) and the ownership check proves the submitter controls.",
  "schema": "astra.registry.plugin/1",
  "id": "detective-game",
  "name": "Detective Case",
  "summary": "Solve procedurally generated crimes with many suspects and evidence-based probabilities, in Astra or Telegram chat.",
  "license": "MIT",
  "source": {
    "kind": "github",
    "repo": "Voltur792/detective-game"
  },
  "added_at": "2026-10-25",
  "description": "Solve procedurally generated crimes with many suspects and evidence-based probabilities, in Astra or Telegram chat.",
  "author": {
    "name": "Voltur"
  },
  "icon": "icon.png",
  "readme": "README.md"
}
