{
  "$comment": "Derived from mihailinl/AstraPlugins@companion-cat-v0.1.5 by bot/ingest.mjs. Every field below is read out of the attested bundle except source.repo, which the submitter names and the ownership check proves.",
  "schema": "astra.registry.plugin/1",
  "id": "companion-cat",
  "name": "Companion Cat",
  "summary": "A cat that flies around the UI and says random things",
  "license": "MIT",
  "source": {
    "kind": "github",
    "repo": "mihailinl/AstraPlugins"
  },
  "added_at": "2026-08-10",
  "description": "A cat that flies around the UI and says random things",
  "author": {
    "name": "Astra Team"
  },
  "readme": "README.md",
  "categories": [
    "entertainment"
  ],
  "keywords": [
    "cat",
    "overlay",
    "companion",
    "fun"
  ],
  "homepage": "https://github.com/mihailinl/AstraPlugins/tree/master/examples/companion"
}
